{
  "$schema": "../../schemas/model-capability-profile.schema.json",
  "schema_version": "1.0", "profile_id": "openai-gpt-5.6-sol", "provider": "OpenAI", "model": "gpt-5.6-sol",
  "purpose": "Optional frontier profile for complex professional reasoning and coding work.", "status": "optional", "checked_at": "2026-08-24",
  "access": {"separate_provisioning": false, "detect_before_use": true, "never_infer": true},
  "capabilities": {"reasoning_efforts": ["none", "low", "medium", "high", "xhigh", "max"], "tools": ["function calling", "web search", "file search", "code interpreter", "hosted shell", "apply patch", "skills", "computer use", "MCP", "tool search"], "structured_outputs": true, "constraints": ["Use representative evals before changing a workload role.", "Keep tool permissions, step limits, approvals, and post-action verification explicit."]},
  "budgets": {"tokens": "Set per workload and test long-context multipliers.", "latency": "Compare the selected reasoning effort on representative tasks.", "tool_steps": "Bound per task contract.", "retries": "Bound and do not repeat without new evidence.", "cost": "Check current official pricing and expected, burst, and worst-case volume before paid execution."},
  "fallback": {"behavior": "Use the project's approved model profile or report an unavailable capability; do not silently change quality, cost, or authority.", "approved_profile_required": true},
  "sources": [{"url": "https://developers.openai.com/api/docs/models/gpt-5.6-sol", "as_of": "2026-08-24"}, {"url": "https://developers.openai.com/api/docs/guides/latest-model?model=gpt-5.6", "as_of": "2026-08-24"}]
}
